{
  "build": {
    "accepted_executable": {
      "path": "bin/xoas-target0-qualification-probe",
      "sha256": "eeeeeeeeeeeeeeeeeeeeeeeeeeeeeeeeeeeeeeeeeeeeeeeeeeeeeeeeeeeeeeee",
      "size_bytes": 65536
    },
    "arguments": [
      "/usr/bin/clang++-21",
      "-std=c++23",
      "-O3",
      "-DNDEBUG",
      "-Wall",
      "-Wextra",
      "-Wpedantic",
      "-Werror",
      "-Wcast-align",
      "-Wconversion",
      "-Wdouble-promotion",
      "-Wextra-semi",
      "-Wformat=2",
      "-Wimplicit-fallthrough",
      "-Wnon-virtual-dtor",
      "-Wold-style-cast",
      "-Woverloaded-virtual",
      "-Wshadow",
      "-Wsign-conversion",
      "-Wundef",
      "-Wzero-as-null-pointer-constant",
      "--ld-path=/usr/bin/ld.lld-21",
      "qualification_probe.cpp",
      "-o",
      "xoas-target0-qualification-probe"
    ],
    "builds": [
      {
        "path": "build-01/xoas-target0-qualification-probe",
        "sha256": "eeeeeeeeeeeeeeeeeeeeeeeeeeeeeeeeeeeeeeeeeeeeeeeeeeeeeeeeeeeeeeee",
        "size_bytes": 65536
      },
      {
        "path": "build-02/xoas-target0-qualification-probe",
        "sha256": "eeeeeeeeeeeeeeeeeeeeeeeeeeeeeeeeeeeeeeeeeeeeeeeeeeeeeeeeeeeeeeee",
        "size_bytes": 65536
      }
    ],
    "environment": {
      "HOME": "/nonexistent",
      "LANG": "C.UTF-8",
      "LC_ALL": "C.UTF-8",
      "PATH": "/usr/bin:/usr/sbin",
      "SOURCE_DATE_EPOCH": "1788026400",
      "TMPDIR": "private-build-directory"
    },
    "executable_sha256": "eeeeeeeeeeeeeeeeeeeeeeeeeeeeeeeeeeeeeeeeeeeeeeeeeeeeeeeeeeeeeeee",
    "identical": true
  },
  "bundle_id": "synthetic-target0-qualification-tools-v1",
  "compatibility_tests": [
    {
      "command": [
        "/usr/bin/python3",
        "tests/target0/qualification_probe_test.py"
      ],
      "exit_status": 0,
      "name": "qualification-probe-behavior",
      "status": "passed",
      "stderr_sha256": "ffffffffffffffffffffffffffffffffffffffffffffffffffffffffffffffff",
      "stdout_sha256": "ffffffffffffffffffffffffffffffffffffffffffffffffffffffffffffffff"
    }
  ],
  "created_at_utc": "2026-08-29T00:00:00Z",
  "elf": {
    "build_id": "0123456789abcdef0123456789abcdef01234567",
    "class": "ELF64",
    "endianness": "little",
    "inspection_logs": [
      {
        "name": "readelf-header",
        "sha256": "aaaaaaaaaaaaaaaaaaaaaaaaaaaaaaaaaaaaaaaaaaaaaaaaaaaaaaaaaaaaaaaa"
      }
    ],
    "interpreter": "/lib64/ld-linux-x86-64.so.2",
    "machine": "Advanced Micro Devices X86-64",
    "needed": [
      "libstdc++.so.6",
      "libm.so.6",
      "libgcc_s.so.1",
      "libc.so.6"
    ],
    "type": "DYN"
  },
  "manifest_version": "xoas.target0-qualification-tool-bundle.v1",
  "performance_claim": false,
  "provisioning_lock": {
    "configuration_sha256": "bbbbbbbbbbbbbbbbbbbbbbbbbbbbbbbbbbbbbbbbbbbbbbbbbbbbbbbbbbbbbbbb",
    "execution_subject": "3333333333333333333333333333333333333333",
    "file_sha256": "cccccccccccccccccccccccccccccccccccccccccccccccccccccccccccccccc",
    "lock_id": "synthetic-target0-lock-v1"
  },
  "rejection_reasons": [],
  "repository": {
    "actual_commit": "1111111111111111111111111111111111111111",
    "expected_commit": "1111111111111111111111111111111111111111",
    "public_remote": "https://github.com/ShaiKKO/XOAS.git",
    "tree": "2222222222222222222222222222222222222222",
    "tree_state": "clean"
  },
  "runtime_dependencies": [
    {
      "loader_path": "/lib/x86_64-linux-gnu/libstdc++.so.6",
      "package": {
        "name": "libstdc++6:amd64",
        "version": "16-20260322-1ubuntu1"
      },
      "realpath": "/usr/lib/x86_64-linux-gnu/libstdc++.so.6.0.35",
      "sha256": "dddddddddddddddddddddddddddddddddddddddddddddddddddddddddddddddd",
      "size_bytes": 2900000,
      "soname": "libstdc++.so.6"
    },
    {
      "loader_path": "/lib/x86_64-linux-gnu/libm.so.6",
      "package": {
        "name": "libc6:amd64",
        "version": "2.43-2ubuntu2.3"
      },
      "realpath": "/usr/lib/x86_64-linux-gnu/libm.so.6",
      "sha256": "1111111111111111111111111111111111111111111111111111111111111111",
      "size_bytes": 940000,
      "soname": "libm.so.6"
    },
    {
      "loader_path": "/lib/x86_64-linux-gnu/libgcc_s.so.1",
      "package": {
        "name": "libgcc-s1:amd64",
        "version": "16-20260322-1ubuntu1"
      },
      "realpath": "/usr/lib/x86_64-linux-gnu/libgcc_s.so.1",
      "sha256": "2222222222222222222222222222222222222222222222222222222222222222",
      "size_bytes": 190000,
      "soname": "libgcc_s.so.1"
    },
    {
      "loader_path": "/lib/x86_64-linux-gnu/libc.so.6",
      "package": {
        "name": "libc6:amd64",
        "version": "2.43-2ubuntu2.3"
      },
      "realpath": "/usr/lib/x86_64-linux-gnu/libc.so.6",
      "sha256": "3333333333333333333333333333333333333333333333333333333333333333",
      "size_bytes": 2200000,
      "soname": "libc.so.6"
    },
    {
      "loader_path": "/lib64/ld-linux-x86-64.so.2",
      "package": {
        "name": "libc6:amd64",
        "version": "2.43-2ubuntu2.3"
      },
      "realpath": "/usr/lib/x86_64-linux-gnu/ld-linux-x86-64.so.2",
      "sha256": "4444444444444444444444444444444444444444444444444444444444444444",
      "size_bytes": 240000,
      "soname": "ld-linux-x86-64.so.2"
    }
  ],
  "sources": [
    {
      "path": "schemas/target0-host-qualification-v1.schema.json",
      "sha256": "eeeeeeeeeeeeeeeeeeeeeeeeeeeeeeeeeeeeeeeeeeeeeeeeeeeeeeeeeeeeeeee"
    },
    {
      "path": "schemas/target0-qualification-tool-bundle-v1.schema.json",
      "sha256": "ffffffffffffffffffffffffffffffffffffffffffffffffffffffffffffffff"
    },
    {
      "path": "schemas/target0-toolchain-lock-v1.schema.json",
      "sha256": "0505050505050505050505050505050505050505050505050505050505050505"
    },
    {
      "path": "tests/target0/capture_host_test.py",
      "sha256": "0202020202020202020202020202020202020202020202020202020202020202"
    },
    {
      "path": "tests/target0/measurement_session_test.py",
      "sha256": "0303030303030303030303030303030303030303030303030303030303030303"
    },
    {
      "path": "tests/target0/qualification_probe_test.py",
      "sha256": "0404040404040404040404040404040404040404040404040404040404040404"
    },
    {
      "path": "tools/target0/capture_host.py",
      "sha256": "cccccccccccccccccccccccccccccccccccccccccccccccccccccccccccccccc"
    },
    {
      "path": "tools/target0/measurement_session.sh",
      "sha256": "dddddddddddddddddddddddddddddddddddddddddddddddddddddddddddddddd"
    },
    {
      "path": "tools/target0/prepare_qualification_bundle.py",
      "sha256": "aaaaaaaaaaaaaaaaaaaaaaaaaaaaaaaaaaaaaaaaaaaaaaaaaaaaaaaaaaaaaaaa"
    },
    {
      "path": "tools/target0/qualification_probe.cpp",
      "sha256": "bbbbbbbbbbbbbbbbbbbbbbbbbbbbbbbbbbbbbbbbbbbbbbbbbbbbbbbbbbbbbbbb"
    },
    {
      "path": "tools/target0/verify_qualification_bundle.py",
      "sha256": "0101010101010101010101010101010101010101010101010101010101010101"
    }
  ],
  "status": "passed",
  "target_id": "target0-amd-ryzen9-7900x-v1",
  "toolchain": {
    "compiler": {
      "driver_path": "/usr/bin/clang++-21",
      "package": {
        "name": "clang-21",
        "version": "1:21.1.8-6ubuntu1"
      },
      "resolved_path": "/usr/lib/llvm-21/bin/clang",
      "sha256": "1111111111111111111111111111111111111111111111111111111111111111",
      "target_triple": "x86_64-pc-linux-gnu",
      "version": "Ubuntu clang version 21.1.8 (6ubuntu1)"
    },
    "linker": {
      "driver_path": "/usr/bin/ld.lld-21",
      "package": {
        "name": "lld-21",
        "version": "1:21.1.8-6ubuntu1"
      },
      "resolved_path": "/usr/lib/llvm-21/bin/lld",
      "sha256": "2222222222222222222222222222222222222222222222222222222222222222",
      "version": "Ubuntu LLD 21.1.8 (compatible with GNU linkers)"
    }
  }
}
